<?xml version="1.0" encoding="utf-8"?>
<!-- Created with Liquid Technologies Online Tools 1.0 (https://www.liquid-technologies.com) -->
<xs:schema xmlns:p="pub_stomp_adapter_v1" xmlns:xsi="http://www.w3.org/2001/XMLSchema-instance" attributeFormDefault="unqualified" elementFormDefault="qualified" targetNamespace="pub_stomp_adapter_v1" xmlns:xs="http://www.w3.org/2001/XMLSchema">
  <xs:element name="pub_stomp_adapter_v1">
    <xs:complexType>
      <xs:sequence>
        <xs:element name="subscriptors">
          <xs:complexType>
            <xs:sequence>
              <xs:element maxOccurs="unbounded" name="subscriptor">
                <xs:complexType>
                  <xs:sequence>
                    <xs:element name="id" type="xs:unsignedByte" />
                    <xs:element name="enabled" type="xs:boolean" />
                    <xs:element name="entity" type="xs:string" />
                  </xs:sequence>
                </xs:complexType>
              </xs:element>
            </xs:sequence>
          </xs:complexType>
        </xs:element>
        <xs:element name="publishers">
          <xs:complexType>
            <xs:sequence>
              <xs:element maxOccurs="unbounded" name="publisher">
                <xs:complexType>
                  <xs:sequence>
                    <xs:element name="id" type="xs:unsignedByte" />
                    <xs:element name="enabled" type="xs:boolean" />
                    <xs:element name="broker" type="xs:string" />
                    <xs:element name="user" type="xs:string" minOccurs="0" maxOccurs="1"/>
                    <xs:element name="password" type="xs:string" minOccurs="0" maxOccurs="1"/>
                    <xs:element name="topics">
                      <xs:complexType>
                        <xs:sequence>
                          <xs:element maxOccurs="unbounded" name="topic">
                            <xs:complexType>
                              <xs:sequence>
                                <xs:element name="id" type="xs:unsignedByte" />
                                <xs:element name="enabled" type="xs:boolean" />
                                <xs:element name="entity" type="xs:string" />
                                <xs:element name="publisher_class" type="xs:string" />
                                <xs:element name="merge_wait_time" type="xs:long" />
                                <xs:element name="subscriptors_ref">
                                  <xs:complexType>
                                    <xs:sequence>
                                      <xs:element maxOccurs="unbounded" name="subscriptor_id_ref" type="xs:unsignedByte" />
                                    </xs:sequence>
                                  </xs:complexType>
                                </xs:element>
                                <xs:element name="custom_path" type="xs:boolean" />
                                <xs:element name="path" type="xs:string" minOccurs="0" maxOccurs="1" />
                              </xs:sequence>
                            </xs:complexType>
                          </xs:element>
                        </xs:sequence>
                      </xs:complexType>
                    </xs:element>
                  </xs:sequence>
                </xs:complexType>
              </xs:element>
            </xs:sequence>
          </xs:complexType>
        </xs:element>
      </xs:sequence>
      <xs:attribute name="name" type="xs:string" use="required" />
      <xs:attribute name="version" type="xs:string" use="required" />
    </xs:complexType>
  </xs:element>
</xs:schema>